{
  "schema_version": "1.0",
  "id": "novel-3ch.chapters",
  "name": "inline:chapters",
  "input_schema": {
    "type": "object",
    "properties": {
      "theme": {},
      "chapters_file": {},
      "outline_file": {}
    },
    "required": [
      "theme",
      "chapters_file",
      "outline_file"
    ]
  },
  "exports": {
    "chapter": {}
  },
  "nodes": [
    {
      "id": "start",
      "type": "start"
    },
    {
      "id": "write-chapter",
      "type": "task",
      "name": "撰写章节正文",
      "output_key": "draft",
      "prompt": "你在连载一篇 ${theme} 短篇小说。先用读文件工具读取章节清单 ${chapters_file}（JSON 数组），取序号为 ${index} 的那一项（0 基下标），得到本章的 number、title、summary、key_events；再读取大纲 ${outline_file} 了解全书设定。按该条目规格撰写本章正文。要求：1) 正文 800-1200 字（按汉字计），本章自成段落又能与相邻章节衔接；2) 末世氛围与重生金手指设定必须与大纲一致，不得引入大纲之外的重大设定；3) 将正文（首行为章节标题）写入文件 novel/chapter-<number>.md（number 取条目字段）；4) 完成后只输出 JSON：{\"$file\":\"novel/chapter-<number>.md 的实际路径\",\"title\":本章标题,\"word_count\":实际字数}。不要在输出中粘贴正文。",
      "output_schema": {
        "type": "object",
        "required": [
          "$file",
          "title",
          "word_count"
        ],
        "properties": {
          "$file": {
            "type": "string"
          },
          "title": {
            "type": "string"
          },
          "word_count": {
            "type": "integer",
            "minimum": 800,
            "maximum": 1200,
            "title": "本章字数"
          }
        }
      }
    },
    {
      "id": "chapter-qc",
      "type": "branch",
      "name": "章节自动质检",
      "prompt": "你是章节自动质检 agent。先读取章节清单 ${chapters_file}，取序号为 ${index} 的项（0 基）得到本章 number、title、key_events；再用读文件工具读取 novel/chapter-<number>.md 与大纲 ${outline_file}，检查：1) 字数是否在 800-1200 之间；2) 是否完整覆盖该项的 key_events；3) 世界观设定与大纲是否一致、与相邻章节是否连贯；4) 文笔与末世/重生氛围是否到位。全部合格只回答 PASS；任一不合格只回答 REVISE。不要输出任何其它内容。",
      "routes": {
        "PASS": "finish-chapter",
        "REVISE": "write-chapter"
      }
    },
    {
      "id": "finish-chapter",
      "type": "task",
      "name": "章节定稿",
      "output_key": "chapter",
      "prompt": "本章自动质检已通过。先读取章节清单 ${chapters_file}，取序号为 ${index} 的项（0 基）得到本章 number、title；再用读文件工具读取 novel/chapter-<number>.md 确认文件存在、内容完整，统计实际字数，确认与大纲 ${outline_file} 的设定一致。只输出 JSON：{\"$file\":\"该文件实际路径\",\"title\":本章标题,\"word_count\":实际字数}。不要在输出中粘贴正文。",
      "output_schema": {
        "type": "object",
        "required": [
          "$file",
          "title",
          "word_count"
        ],
        "properties": {
          "$file": {
            "type": "string"
          },
          "title": {
            "type": "string"
          },
          "word_count": {
            "type": "integer",
            "minimum": 800,
            "maximum": 1200,
            "title": "本章字数"
          }
        }
      }
    },
    {
      "id": "end",
      "type": "end"
    }
  ],
  "edges": [
    {
      "from": "write-chapter",
      "to": "chapter-qc"
    },
    {
      "from": "start",
      "to": "write-chapter"
    },
    {
      "from": "finish-chapter",
      "to": "end"
    }
  ]
}
