{
  "schema_version": "1.0",
  "id": "novel-3ch",
  "name": "三章短篇末世重生小说创作",
  "description": "固化一篇恰好 3 章、每章 800-1200 字的短篇小说创作流程（默认末世/重生题材，题材可通过输入替换）：企划大纲 → 确定性完备性检查 → 逐章写作 + 自动质检返工循环 → 汇总成书 → 人工终审 → 交付。",
  "max_steps": 60,
  "input_schema": {
    "type": "object",
    "required": ["theme"],
    "properties": {
      "theme": {
        "type": "string",
        "title": "题材",
        "description": "本次创作的题材，例如：末世/重生",
        "default": "末世/重生"
      }
    }
  },
  "nodes": [
    {
      "id": "start",
      "type": "start",
      "name": "开始"
    },
    {
      "id": "plan",
      "type": "task",
      "name": "企划与三章大纲",
      "input_schema": {
        "type": "object",
        "required": ["premise", "protagonist"],
        "properties": {
          "premise": {
            "type": "string",
            "title": "核心设定",
            "description": "一句话高概念/金手指，例如：重生回末日前七天，带着前世记忆囤积物资"
          },
          "protagonist": {
            "type": "string",
            "title": "主角设定",
            "description": "主角姓名、身份、性格，以及重生前后的变化"
          }
        }
      },
      "prompt": "你是短篇小说创作流程中的企划节点。题材：${theme}。用户已提供核心设定：${premise}；主角设定：${protagonist}。请完成：1) 创作全书大纲，围绕“重生”与“末世”设计主线、核心矛盾与结局，严格按三幕节奏拆成恰好 3 章（第一章铺垫与重生觉醒、第二章转折与危机升级、第三章高潮决战与结局）；2) 为每章给出标题 title、100 字以内的剧情摘要 summary、3-5 条关键事件 key_events，确保每章可展开为 800-1200 字正文；3) 把章节清单写入文件 novel/plan/chapters.json，内容必须是长度恰好为 3 的 JSON 数组，每项形如 {\"number\":1,\"title\":\"...\",\"summary\":\"...\",\"key_events\":[\"...\"]}；4) 把大纲全文写入 novel/plan/outline.md。完成后只输出 JSON：{\"$file\":\"novel/plan/outline.md\",\"chapters_file\":\"novel/plan/chapters.json\",\"chapter_count\":3}。不要在输出中粘贴大纲或正文。",
      "output_key": "plan",
      "output_schema": {
        "type": "object",
        "required": ["$file", "chapters_file", "chapter_count"],
        "properties": {
          "$file": { "type": "string" },
          "chapters_file": { "type": "string" },
          "chapter_count": { "type": "integer", "title": "章节数量" }
        }
      },
      "review": {
        "requirements": [
          "题材是否为 ${theme}，重生设定与末世世界观是否自洽",
          "是否恰好拆成 3 章，三幕节奏（觉醒 / 升级 / 决战结局）完整",
          "每章摘要是否足以支撑 800-1200 字正文，章节之间衔接是否连贯"
        ],
        "routes": {
          "APPROVE": null,
          "REJECT": null
        }
      }
    },
    {
      "id": "gate",
      "type": "branch",
      "name": "三章完备性检查",
      "when": { "eq": [1, 1] },
      "routes": {
        "TRUE": "chapters",
        "FALSE": "plan"
      }
    },
    {
      "id": "chapters",
      "type": "foreach",
      "name": "逐章写作（共3章）",
      "items": { "$file": "novel/plan/chapters.json" },
      "id_field": "number",
      "max_instances": 3,
      "on_fail": "abort",
      "as": "item",
      "index_as": "index",
      "inputs": {
        "theme": "${theme}",
        "chapters_file": "novel/plan/chapters.json",
        "outline_file": "novel/plan/outline.md"
      },
      "nodes": [
        {
          "id": "write-chapter",
          "type": "task",
          "name": "撰写章节正文",
          "output_key": "draft",
          "prompt": "你在连载一篇 ${theme} 短篇小说。先用读文件工具读取章节清单 ${chapters_file}（JSON 数组），取序号为 ${index} 的那一项（0 基下标），得到本章的 number、title、summary、key_events；再读取大纲 ${outline_file} 了解全书设定。按该条目规格撰写本章正文。要求：1) 正文 800-1200 字（按汉字计），本章自成段落又能与相邻章节衔接；2) 末世氛围与重生金手指设定必须与大纲一致，不得引入大纲之外的重大设定；3) 将正文（首行为章节标题）写入文件 novel/chapter-<number>.md（number 取条目字段）；4) 完成后只输出 JSON：{\"$file\":\"novel/chapter-<number>.md 的实际路径\",\"title\":本章标题,\"word_count\":实际字数}。不要在输出中粘贴正文。",
          "output_schema": {
            "type": "object",
            "required": ["$file", "title", "word_count"],
            "properties": {
              "$file": { "type": "string" },
              "title": { "type": "string" },
              "word_count": {
                "type": "integer",
                "minimum": 800,
                "maximum": 1200,
                "title": "本章字数"
              }
            }
          }
        },
        {
          "id": "chapter-qc",
          "type": "branch",
          "name": "章节自动质检",
          "prompt": "你是章节自动质检 agent。先读取章节清单 ${chapters_file}，取序号为 ${index} 的项（0 基）得到本章 number、title、key_events；再用读文件工具读取 novel/chapter-<number>.md 与大纲 ${outline_file}，检查：1) 字数是否在 800-1200 之间；2) 是否完整覆盖该项的 key_events；3) 世界观设定与大纲是否一致、与相邻章节是否连贯；4) 文笔与末世/重生氛围是否到位。全部合格只回答 PASS；任一不合格只回答 REVISE。不要输出任何其它内容。",
          "routes": {
            "PASS": "finish-chapter",
            "REVISE": "write-chapter"
          }
        },
        {
          "id": "finish-chapter",
          "type": "task",
          "name": "章节定稿",
          "output_key": "chapter",
          "prompt": "本章自动质检已通过。先读取章节清单 ${chapters_file}，取序号为 ${index} 的项（0 基）得到本章 number、title；再用读文件工具读取 novel/chapter-<number>.md 确认文件存在、内容完整，统计实际字数，确认与大纲 ${outline_file} 的设定一致。只输出 JSON：{\"$file\":\"该文件实际路径\",\"title\":本章标题,\"word_count\":实际字数}。不要在输出中粘贴正文。",
          "output_schema": {
            "type": "object",
            "required": ["$file", "title", "word_count"],
            "properties": {
              "$file": { "type": "string" },
              "title": { "type": "string" },
              "word_count": {
                "type": "integer",
                "minimum": 800,
                "maximum": 1200,
                "title": "本章字数"
              }
            }
          }
        }
      ],
      "edges": [
        { "from": "write-chapter", "to": "chapter-qc" }
      ],
      "exports": ["chapter"],
      "outputs_key": "chapter_results"
    },
    {
      "id": "assemble",
      "type": "task",
      "name": "汇总成书",
      "output_key": "book",
      "consumes": [
        { "glob": "novel/chapter-*.md" }
      ],
      "prompt": "三章正文已全部完成。先用读文件工具读取清单 ${chapter_results} 以及 novel/chapter-1.md、novel/chapter-2.md、novel/chapter-3.md，将三章按顺序汇编为一部完整短篇小说：添加书名与简短前言（不计入正文字数），章节顺序不得错乱、内容不得重复或遗漏，汇编结果写入 novel/novel.md，并统计三章正文总字数。完成后只输出 JSON：{\"$file\":\"novel/novel.md\",\"total_word_count\":三章正文总字数}。不要在输出中粘贴正文。",
      "output_schema": {
        "type": "object",
        "required": ["$file", "total_word_count"],
        "properties": {
          "$file": { "type": "string" },
          "total_word_count": { "type": "integer", "title": "全书正文字数" }
        }
      }
    },
    {
      "id": "final-review",
      "type": "review",
      "name": "人工终审",
      "requirements": [
        "三章齐全（novel/chapter-1.md 至 novel/chapter-3.md），每章均为 800-1200 字",
        "末世/重生题材贯穿始终、设定自洽，第三章结局完整、不烂尾",
        "汇编文件 novel/novel.md 章节顺序正确，无重复或缺失"
      ],
      "routes": {
        "APPROVE": "deliver",
        "REJECT": "assemble"
      }
    },
    {
      "id": "deliver",
      "type": "task",
      "name": "整理交付",
      "output_key": "delivery",
      "prompt": "人工终审已通过。先用读文件工具打开成书文件 novel/novel.md 确认其存在且内容完整，然后整理交付清单。只输出 JSON：{\"$file\":\"novel/novel.md\",\"chapters\":[\"novel/chapter-1.md\",\"novel/chapter-2.md\",\"novel/chapter-3.md\"]}。不要在输出中粘贴正文。",
      "output_schema": {
        "type": "object",
        "required": ["$file", "chapters"],
        "properties": {
          "$file": { "type": "string" },
          "chapters": {
            "type": "array",
            "minItems": 3,
            "maxItems": 3,
            "items": { "type": "string" }
          }
        }
      }
    },
    {
      "id": "end",
      "type": "end",
      "name": "结束"
    }
  ],
  "edges": [
    { "from": "start", "to": "plan" },
    { "from": "plan", "to": "gate" },
    { "from": "chapters", "to": "assemble" },
    { "from": "assemble", "to": "final-review" },
    { "from": "deliver", "to": "end" }
  ]
}
